{
  "buyer_terms": [
    "agency",
    "department",
    "university",
    "hospital",
    "company",
    "group",
    "institute",
    "center",
    "school",
    "government",
    "bureau"
  ],
  "procurement_terms": [
    "procurement",
    "tender",
    "request for proposal",
    "rfp",
    "request for quotation",
    "rfq",
    "bid",
    "purchase",
    "contract"
  ],
  "negative_terms": [
    "job vacancy",
    "recruitment",
    "property sale",
    "personal loan"
  ],
  "stage_weights": {
    "procurement plan": 8,
    "request for information": 8,
    "tender notice": 5,
    "request for proposal": 5,
    "request for quotation": 4,
    "award notice": -12,
    "cancelled": -18,
    "correction": -2
  },
  "focus_regions": [],
  "min_budget_cny": 0,
  "sales_profile": {
    "name": "Example sales profile",
    "all_business_lines": true,
    "focus_regions": [],
    "minimum_followup_budget_cny": 0,
    "priority_accounts": []
  },
  "meta": {
    "id": "it-digital",
    "title": "IT, software and digital transformation",
    "description": "Software development, cloud, data, AI, cybersecurity and enterprise systems."
  },
  "business_lines": [
    {
      "id": "software_delivery",
      "name": "Software development and enterprise applications",
      "base_score": 24,
      "strong_terms": [
        "software development",
        "application development",
        "ERP",
        "CRM",
        "business system",
        "digital platform",
        "information system",
        "\u8f6f\u4ef6\u5f00\u53d1",
        "\u4fe1\u606f\u5316\u5efa\u8bbe",
        "\u6570\u5b57\u5316\u5e73\u53f0"
      ],
      "related_terms": [
        "system integration",
        "maintenance service",
        "mobile app",
        "workflow",
        "API",
        "\u7cfb\u7edf\u96c6\u6210",
        "\u8fd0\u7ef4\u670d\u52a1"
      ]
    },
    {
      "id": "data_ai_cloud",
      "name": "Data, AI and cloud",
      "base_score": 25,
      "strong_terms": [
        "data platform",
        "artificial intelligence",
        "machine learning",
        "large language model",
        "cloud platform",
        "data governance",
        "\u4eba\u5de5\u667a\u80fd",
        "\u5927\u6a21\u578b",
        "\u6570\u636e\u6cbb\u7406",
        "\u4e91\u5e73\u53f0"
      ],
      "related_terms": [
        "analytics",
        "data warehouse",
        "GPU",
        "knowledge base",
        "private cloud",
        "\u6570\u636e\u4e2d\u53f0",
        "\u77e5\u8bc6\u5e93"
      ]
    },
    {
      "id": "cybersecurity",
      "name": "Cybersecurity",
      "base_score": 25,
      "strong_terms": [
        "cybersecurity",
        "security operations center",
        "penetration testing",
        "zero trust",
        "SIEM",
        "\u7f51\u7edc\u5b89\u5168",
        "\u7b49\u4fdd\u6d4b\u8bc4",
        "\u5b89\u5168\u8fd0\u8425\u4e2d\u5fc3"
      ],
      "related_terms": [
        "firewall",
        "vulnerability scan",
        "identity management",
        "audit",
        "\u9632\u706b\u5899",
        "\u6f0f\u6d1e\u626b\u63cf"
      ]
    }
  ]
}
