{
  "buyer_terms": [
    "procurement department",
    "finance department",
    "legal department",
    "risk management department",
    "internal audit department",
    "public authority",
    "state-owned enterprise",
    "university administration",
    "hospital administration",
    "采购部门",
    "财务部门",
    "法务部门",
    "风险管理部门",
    "内部审计部门",
    "事业单位",
    "国有企业"
  ],
  "procurement_terms": [
    "procurement",
    "tender",
    "request for proposal",
    "rfp",
    "request for quotation",
    "rfq",
    "invitation to bid",
    "framework agreement",
    "consulting contract",
    "professional services agreement",
    "采购",
    "招标",
    "询价",
    "竞争性磋商",
    "框架协议"
  ],
  "negative_terms": [
    "consultant recruitment",
    "lawyer recruitment",
    "graduate recruitment",
    "job vacancy",
    "admissions consulting",
    "personal tax return",
    "招聘顾问",
    "律师招聘",
    "校园招聘",
    "招聘岗位",
    "招生咨询",
    "个人报税"
  ],
  "stage_weights": {
    "procurement plan": 8,
    "request for information": 8,
    "tender notice": 5,
    "request for proposal": 5,
    "request for quotation": 4,
    "award notice": -12,
    "cancelled": -18,
    "correction": -2,
    "采购意向": 8,
    "招标公告": 5,
    "中标公告": -12
  },
  "focus_regions": [],
  "min_budget_cny": 0,
  "sales_profile": {
    "name": "Example professional-services sales profile",
    "all_business_lines": true,
    "focus_regions": [],
    "minimum_followup_budget_cny": 0,
    "priority_accounts": []
  },
  "meta": {
    "id": "professional-services",
    "title": "Professional and advisory services",
    "description": "Management advisory, finance and assurance, legal, and corporate professional services."
  },
  "business_lines": [
    {
      "id": "management_strategy_advisory",
      "name": "Management, strategy, and operational advisory",
      "base_score": 24,
      "strong_terms": [
        "management consulting services",
        "strategy consulting services",
        "organizational transformation consulting",
        "business process optimization consulting",
        "operating model design",
        "feasibility study services",
        "commercial due diligence",
        "public policy research services",
        "管理咨询服务",
        "战略咨询服务",
        "组织变革咨询",
        "业务流程优化咨询",
        "运营模式设计",
        "可行性研究服务",
        "商业尽职调查",
        "政策研究服务"
      ],
      "related_terms": [
        "stakeholder engagement plan",
        "benchmarking study",
        "implementation roadmap",
        "performance management framework",
        "change management program",
        "governance framework design",
        "利益相关方沟通方案",
        "对标研究",
        "实施路线图",
        "绩效管理体系",
        "变革管理方案",
        "治理体系设计"
      ]
    },
    {
      "id": "finance_risk_assurance",
      "name": "Finance, audit, tax, risk, and assurance services",
      "base_score": 25,
      "strong_terms": [
        "external audit services",
        "financial statement audit",
        "internal audit services",
        "tax advisory services",
        "actuarial consulting services",
        "enterprise risk management consulting",
        "compliance review services",
        "forensic accounting services",
        "审计服务",
        "财务报表审计",
        "内部审计服务",
        "税务咨询服务",
        "精算咨询服务",
        "全面风险管理咨询",
        "合规审查服务",
        "法务会计服务"
      ],
      "related_terms": [
        "audit planning",
        "control testing",
        "risk assessment framework",
        "tax compliance review",
        "financial controls review",
        "fraud risk assessment",
        "审计计划",
        "内部控制测试",
        "风险评估体系",
        "税务合规审查",
        "财务内控评估",
        "舞弊风险评估"
      ]
    },
    {
      "id": "legal_corporate_services",
      "name": "Legal, intellectual-property, and corporate services",
      "base_score": 25,
      "strong_terms": [
        "external legal counsel services",
        "general legal counsel retainer",
        "litigation representation services",
        "intellectual property legal services",
        "contract review legal services",
        "regulatory legal advisory",
        "corporate secretarial services",
        "常年法律顾问服务",
        "外聘法律顾问",
        "诉讼代理服务",
        "知识产权法律服务",
        "合同审查法律服务",
        "监管法律咨询",
        "公司秘书服务"
      ],
      "related_terms": [
        "legal due diligence",
        "contract negotiation support",
        "trademark portfolio management",
        "patent prosecution support",
        "regulatory compliance advice",
        "legal opinion drafting",
        "法律尽职调查",
        "合同谈判支持",
        "商标组合管理",
        "专利申请代理",
        "监管合规意见",
        "法律意见书起草"
      ]
    }
  ]
}
